run_utc,organization_id,organization_name,datasets_count
2026-02-10T04:03:37Z,534fff91a3a7292c64a77f73,Ministère de la Culture,181
2026-02-10T04:03:37Z,534fff5ea3a7292c64a77d40,Centre des monuments nationaux,4
2026-02-10T04:03:37Z,534fff5fa3a7292c64a77d49,Centre national du cinéma et de l'image animée,34
2026-02-10T04:03:37Z,534fff5fa3a7292c64a77d44,Centre national d'art et de culture Georges Pompidou,0
2026-02-10T04:03:37Z,534fff60a3a7292c64a77d55,Cité de la musique,0
2026-02-10T04:03:37Z,534fff71a3a7292c64a77dcd,École nationale supérieure d'art Villa Arson de Nice,7
2026-02-10T04:03:37Z,534fff72a3a7292c64a77dd0,École nationale supérieure des métiers de l'image et du son (La Fémis),3
2026-02-10T04:03:37Z,534fff73a3a7292c64a77dda,Établissement public de la Réunion des musées nationaux et du Grand Palais des Champs-Élysées,0
2026-02-10T04:03:37Z,534fff74a3a7292c64a77ddd,"Établissement public du château, du musée et du domaine national de Versailles",0
2026-02-10T04:03:37Z,534fff74a3a7292c64a77de0,Établissement public du musée d'Orsay et du musée de l'Orangerie,2
2026-02-10T04:03:37Z,534fff82a3a7292c64a77e82,Institut national de recherches archéologiques préventives,3
2026-02-10T04:03:37Z,534fff97a3a7292c64a7800b,Musée des arts asiatiques Guimet,3
2026-02-10T04:03:37Z,534fff98a3a7292c64a7800e,Musée du Louvre,0
2026-02-10T04:03:37Z,534fffb2a3a7292c64a78125,"Théâtre national de l'Odéon, Théâtre de l'Europe",0
2026-02-10T04:03:37Z,57fe0dfac751df15a779df72,Institut national de l'audiovisuel,7
